[
  {
    "id": "hl-walker",
    "title": "Dr. Matt Walker: The Science & Practice of Perfecting Your Sleep (episode transcript)",
    "authors": "Huberman Lab",
    "url": "https://www.hubermanlab.com/episode/dr-matthew-walker-the-science-and-practice-of-perfecting-your-sleep",
    "year": 2024,
    "quality": "Primary transcript; verifies wording"
  },
  {
    "id": "hl-cold",
    "title": "Using Deliberate Cold Exposure for Health and Performance (Huberman Lab, 4 Apr 2022)",
    "authors": "Huberman Lab",
    "url": "https://www.hubermanlab.com/episode/using-deliberate-cold-exposure-for-health-and-performance",
    "year": 2022,
    "quality": "Primary transcript; quotes verified"
  },
  {
    "id": "sramek-2000",
    "title": "Human physiological responses to immersion into water of different temperatures (Eur J Appl Physiol 81:436-442)",
    "authors": "\u0160r\u00e1mek P, \u0160ime\u010dkov\u00e1 M, Jansk\u00fd L, \u0160avl\u00edkov\u00e1 J, Vyb\u00edral S",
    "url": "https://doi.org/10.1007/s004210050065",
    "year": 2000,
    "quality": "Small experiment n=10; plasma measures"
  },
  {
    "id": "claimgrade-cold",
    "title": "Cold plunge & the '250% dopamine' claim: review",
    "authors": "ClaimGrade",
    "url": "https://claimgrade.org/reviews/cold-plunge/report",
    "year": 2025,
    "quality": "Secondary fact-check; context only"
  },
  {
    "id": "caff-review",
    "title": "Common questions and misconceptions about caffeine supplementation (J Int Soc Sports Nutr 21:2323919)",
    "authors": "Antonio J et al.",
    "url": "https://pmc.ncbi.nlm.nih.gov/articles/PMC10930107/",
    "year": 2024,
    "quality": "Narrative review; moderate"
  },
  {
    "id": "laukkanen-2015",
    "title": "Association Between Sauna Bathing and Fatal Cardiovascular and All-Cause Mortality Events (JAMA Intern Med 175:542-548)",
    "authors": "Laukkanen T, Khan H, Zaccardi F, Laukkanen JA",
    "url": "https://jamanetwork.com/journals/jamainternalmedicine/fullarticle/2130724",
    "year": 2015,
    "quality": "Prospective cohort n=2315 men; observational"
  },
  {
    "id": "patrick-sauna",
    "title": "Sauna use as a lifestyle practice to extend healthspan (Exp Gerontol 154:111509)",
    "authors": "Patrick RP, Johnson TL",
    "url": "https://www.sciencedirect.com/science/article/pii/S0531556521002916",
    "year": 2021,
    "quality": "Narrative review co-authored by the claimant; note COI"
  },
  {
    "id": "mandsager-2018",
    "title": "Association of Cardiorespiratory Fitness With Long-term Mortality Among Adults Undergoing Exercise Treadmill Testing (JAMA Netw Open 1:e183605)",
    "authors": "Mandsager K, Harb S, Cremer P, et al.",
    "url": "https://doi.org/10.1001/jamanetworkopen.2018.3605",
    "year": 2018,
    "quality": "Retrospective cohort n=122,007; observational"
  },
  {
    "id": "attia-vo2",
    "title": "How does VO2 max correlate with longevity? (AMA #27 show notes)",
    "authors": "Attia P",
    "url": "https://peterattiamd.com/how-does-vo2-max-correlate-with-longevity/",
    "year": 2022,
    "quality": "Primary claimant page"
  },
  {
    "id": "magellan-hub",
    "title": "Andrew Huberman's Longevity Claims, Checked Against the Papers",
    "authors": "Magellan Longevity",
    "url": "https://magellanlongevity.com/claims/andrew-huberman/",
    "year": 2025,
    "quality": "Secondary fact-check; context"
  },
  {
    "id": "roberts-2015",
    "title": "Post-exercise cold water immersion attenuates acute anabolic signalling and long-term adaptations in muscle to strength training (J Physiol 593:4285-4301)",
    "authors": "Roberts LA et al.",
    "url": "https://doi.org/10.1113/JP270570",
    "year": 2015,
    "quality": "RCT; moderate"
  },
  {
    "id": "gbd-2018",
    "title": "Alcohol use and burden for 195 countries and territories, 1990-2016 (Lancet 392:1015-1035)",
    "authors": "GBD 2016 Alcohol Collaborators",
    "url": "https://doi.org/10.1016/S0140-6736(18)31310-2",
    "year": 2018,
    "quality": "Large modelling study; high-profile, debated"
  },
  {
    "id": "who-alcohol",
    "title": "No level of alcohol consumption is safe for our health (WHO Europe statement)",
    "authors": "WHO Regional Office for Europe",
    "url": "https://www.who.int/europe/news/item/04-01-2023-no-level-of-alcohol-consumption-is-safe-for-our-health",
    "year": 2023,
    "quality": "Health agency; high"
  },
  {
    "id": "hl-alcohol",
    "title": "What Alcohol Does to Your Body, Brain & Health (Huberman Lab, Aug 2022)",
    "authors": "Huberman Lab",
    "url": "https://www.hubermanlab.com/episode/what-alcohol-does-to-your-body-brain-health",
    "year": 2022,
    "quality": "Primary episode page"
  },
  {
    "id": "guzey",
    "title": "Matthew Walker's 'Why We Sleep' Is Riddled with Scientific and Factual Errors",
    "authors": "Guzey A",
    "url": "https://guzey.com/books/why-we-sleep/",
    "year": 2019,
    "quality": "Independent critique; detailed, not peer-reviewed"
  },
  {
    "id": "hl-light",
    "title": "Using Light (Sunlight, Blue Light & Red Light) to Optimize Health (episode transcript)",
    "authors": "Huberman Lab",
    "url": "https://www.hubermanlab.com/episode/using-light-sunlight-blue-light-and-red-light-to-optimize-health",
    "year": 2022,
    "quality": "Primary transcript"
  },
  {
    "id": "leproult-2001",
    "title": "Transition from dim to bright light in the morning induces an immediate elevation of cortisol levels (J Clin Endocrinol Metab 86:151-157)",
    "authors": "Leproult R, Colecchia EF, L'Hermite-Bal\u00e9riaux M, Van Cauter E",
    "url": "https://doi.org/10.1210/jcem.86.1.7102",
    "year": 2001,
    "quality": "Small lab study; moderate"
  },
  {
    "id": "khalsa-2003",
    "title": "A phase response curve to single bright light pulses in human subjects (J Physiol 549:945-952)",
    "authors": "Khalsa SBS et al.",
    "url": "https://doi.org/10.1113/jphysiol.2003.040477",
    "year": 2003,
    "quality": "Controlled lab; high for circadian phase shifting"
  },
  {
    "id": "vital-2019",
    "title": "Marine n-3 fatty acids and prevention of cardiovascular disease and cancer (VITAL, NEJM 380:23-32)",
    "authors": "Manson JE et al.",
    "url": "https://doi.org/10.1056/NEJMoa1811403",
    "year": 2019,
    "quality": "Large RCT; high"
  },
  {
    "id": "reduce-it",
    "title": "Cardiovascular Risk Reduction with Icosapent Ethyl for Hypertriglyceridemia (REDUCE-IT, NEJM 380:11-22)",
    "authors": "Bhatt DL et al.",
    "url": "https://doi.org/10.1056/NEJMoa1812792",
    "year": 2019,
    "quality": "Large RCT; high; mineral-oil placebo debate"
  },
  {
    "id": "cochrane-omega3",
    "title": "Omega-3 fatty acids for the primary and secondary prevention of cardiovascular disease (Cochrane)",
    "authors": "Abdelhamid AS et al.",
    "url": "https://doi.org/10.1002/14651858.CD003177.pub5",
    "year": 2020,
    "quality": "Systematic review; high"
  },
  {
    "id": "fmf-omega3",
    "title": "Omega-3 fatty acids topic page",
    "authors": "FoundMyFitness (Rhonda Patrick)",
    "url": "https://www.foundmyfitness.com/topics/omega-3",
    "year": 2024,
    "quality": "Primary claimant page"
  },
  {
    "id": "mcmahon-2017",
    "title": "Meta-analysis of the association between vitamin D and mortality / VITAL vitamin D (Manson JE et al. NEJM 380:33-44)",
    "authors": "Manson JE et al.",
    "url": "https://doi.org/10.1056/NEJMoa1809944",
    "year": 2019,
    "quality": "Large RCT; high"
  },
  {
    "id": "fmf-vitd",
    "title": "Vitamin D topic page",
    "authors": "FoundMyFitness (Rhonda Patrick)",
    "url": "https://www.foundmyfitness.com/topics/vitamin-d",
    "year": 2024,
    "quality": "Primary claimant page"
  },
  {
    "id": "sulf-review",
    "title": "Sulforaphane clinical trials review (Yagishita Y et al. 2019, Molecules 24:3593)",
    "authors": "Yagishita Y, Fahey JW, Dinkova-Kostova AT, Kensler TW",
    "url": "https://doi.org/10.3390/molecules24193593",
    "year": 2019,
    "quality": "Narrative review of human trials; moderate"
  },
  {
    "id": "caveat-rp",
    "title": "Rhonda Patrick protocols: what the evidence says",
    "authors": "Caveat",
    "url": "https://caveat-ai.com/checks/rhonda-patrick-protocol",
    "year": 2025,
    "quality": "Secondary; context"
  },
  {
    "id": "nmn-review",
    "title": "Efficacy of oral nicotinamide mononucleotide supplementation on glucose and lipid metabolism for adults: a systematic review with meta-analysis on RCTs (Crit Rev Food Sci Nutr)",
    "authors": "(see DOI)",
    "url": "https://doi.org/10.1080/10408398.2024.2387324",
    "year": 2024,
    "quality": "SR/MA of 12 RCTs (n=513); moderate"
  },
  {
    "id": "metformin-tame",
    "title": "Metformin as a Tool to Target Aging (TAME) (Cell Metab 23:1060-1065)",
    "authors": "Barzilai N, Crandall JP, Kritchevsky SB, Espeland MA",
    "url": "https://doi.org/10.1016/j.cmet.2016.05.011",
    "year": 2016,
    "quality": "Trial rationale paper; not outcome evidence"
  },
  {
    "id": "masters-2019",
    "title": "Metformin blunts muscle hypertrophy in response to progressive resistance exercise training in older adults: the MASTERS trial (Aging Cell 18:e13039)",
    "authors": "Walton RG et al.",
    "url": "https://doi.org/10.1111/acel.13039",
    "year": 2019,
    "quality": "RCT; moderate"
  },
  {
    "id": "rapamycin-review",
    "title": "Rapamycin and aging in humans: systematic review (Lee DJW et al. 2024, Lancet Healthy Longev 5:e152)",
    "authors": "Lee DJW, Hodzic Kuerec A, Maier AB",
    "url": "https://doi.org/10.1016/S2666-7568(23)00258-1",
    "year": 2024,
    "quality": "Systematic review; moderate"
  },
  {
    "id": "tre-rct",
    "title": "Calorie restriction with or without time-restricted eating in weight loss (NEJM 386:1495-1504)",
    "authors": "Liu D et al.",
    "url": "https://doi.org/10.1056/NEJMoa2114833",
    "year": 2022,
    "quality": "RCT n=139; high"
  },
  {